{
  "apiVersion": "rrp.dev/v1",
  "kind": "Workflow",
  "metadata": {
    "id": "notepad-read",
    "name": "Inspect Notepad",
    "createdAt": "2026-07-12T00:00:00Z"
  },
  "requires": {
    "protocol": "rrp/1.0",
    "all": [
      "desktop.session-probe"
    ]
  },
  "parameters": {},
  "steps": [
    {
      "id": "inspect-window",
      "action": "desktop.inspect",
      "target": null,
      "input": null,
      "preconditions": null,
      "postconditions": [
        {
          "assertion": "window.visible",
          "target": null,
          "value": null
        }
      ],
      "approval": null,
      "timeoutMs": 10000
    }
  ]
}